{"schema_version":1,"role_id":"hive-article-writer","display_name":"Article writer","description":"Write a structured article or long-form human guide.","scope":"project","reserved":false,"permission":"bounded-write","positive_triggers":["write article","long-form guide"],"negative_triggers":["code implementation","simple question"],"host_mappings":{"codex":{"model":"gpt-5.6-sol","effort":"high","minimum_version":"0.147.0"},"claude":{"model":"claude-sonnet-5","effort":"high","minimum_version":"2.1.163"}},"definition_digest":"sha256:83ef657a664bf1b5a220e71490b0c24e68591a6e7f5b8eeadd0483c45a1987aa"}
