{"schema_version":1,"role_id":"hive-independent-judge","display_name":"Independent Judge","description":"Independently judge terminal acceptance from fresh read-only evidence.","scope":"user","reserved":true,"permission":"read-only","positive_triggers":["terminal acceptance","independent judge"],"negative_triggers":["scheduler tick","heartbeat"],"host_mappings":{"codex":{"model":"gpt-5.6-sol","effort":"high","minimum_version":"0.147.0"},"claude":{"model":"claude-opus-4-8","effort":"max","minimum_version":"2.1.163"}},"definition_digest":"sha256:c9002f6d3d3b60006a29ff65e14ad248b04bbdc876580ee3cda6a48302d96f00"}
