{"schema_version":1,"role_id":"hive-routine-implementer","display_name":"Routine implementer","description":"Apply repetitive or well-scoped implementation changes.","scope":"project","reserved":false,"permission":"bounded-write","positive_triggers":["routine implementation","repetitive change"],"negative_triggers":["simple question","architecture decision"],"host_mappings":{"codex":{"model":"gpt-5.6-luna","effort":"max","minimum_version":"0.147.0"},"claude":{"model":"claude-sonnet-5","effort":"high","minimum_version":"2.1.163"}},"definition_digest":"sha256:e8afb5ec85e62d1545caac60b2eb59cf9446d5ad96304e9c0b748ba00d225535"}
