{"schema_version":1,"role_id":"hive-complex-implementer","display_name":"Complex implementer","description":"Implement complex changes that require architectural reasoning.","scope":"project","reserved":false,"permission":"bounded-write","positive_triggers":["complex implementation","architecture implementation"],"negative_triggers":["simple question","format only"],"host_mappings":{"codex":{"model":"gpt-5.6-terra","effort":"max","minimum_version":"0.147.0"},"claude":{"model":"claude-opus-4-8","effort":"max","minimum_version":"2.1.163"}},"definition_digest":"sha256:0813ac06534172c20f16f53f8e7816a387580fe353ef70923244910388af34a5"}
